2026-07-15,NYSE,AXIA Energia American Depositary Shares (Each representing one Common Share),AXIA,29162.0,9.920000076293945,-6.06,-20.96,-3.88,46.75
2026-07-15,NASDAQ,AST SpaceMobile Inc. Class A Common Stock,ASTS,29089.9,66.30999755859375,-25.38,-10.27,-40.37,24.71
2026-07-15,NYSE,NRG Energy Inc. Common Stock,NRG,29006.4,137.89999389648438,-5.59,-11.36,-9.65,-17.52
2026-07-15,NYSE,Citizens Financial Group Inc. Common Stock,CFG,28992.8,71.12000274658203,1.5,9.33,12.92,49.04
2026-07-15,NASDAQ,MongoDB Inc. Class A Common Stock,MDB,28907.2,333.0400085449219,-0.85,32.78,-10.31,40.0
2026-07-15,NYSE,CenterPoint Energy Inc (Holding Co) Common Stock,CNP,28816.2,42.720001220703125,-3.0,-2.13,7.63,10.05
2026-07-15,NYSE,Edison International Common Stock,EIX,28774.9,76.68000030517578,3.0,10.35,23.12,47.12
2026-07-15,NASDAQ,DexCom Inc. Common Stock,DXCM,28577.8,72.7300033569336,7.99,22.13,-0.42,-9.95
2026-07-15,NASDAQ,Illumina Inc. Common Stock,ILMN,28415.7,187.14999389648438,6.44,47.66,29.24,82.21
2026-07-15,NYSE,Dover Corporation Common Stock,DOV,28476.8,212.25999450683594,-5.36,-6.25,5.35,17.18
2026-07-15,NYSE,Xylem Inc. Common Stock New,XYL,28195.2,121.43000030517578,2.72,2.77,-11.92,-16.04
2026-07-15,NYSE,Tapestry Inc. Common Stock,TPR,28314.5,140.25999450683594,-4.18,-3.3,10.52,29.83
2026-07-15,NASDAQ,Cincinnati Financial Corporation Common Stock,CINF,28085.7,172.42999267578125,-6.87,5.4,7.17,16.89
2026-07-15,NYSE,Curtiss-Wright Corporation Common Stock,CW,28096.3,751.6400146484375,-0.81,4.37,14.46,53.33
2026-07-15,NYSE,TechnipFMC plc Ordinary Share,FTI,28064.6,72.2699966430664,9.0,-4.37,29.7,98.71
2026-07-15,NYSE,VICI Properties Inc. Common Stock,VICI,27891.0,26.309999465942383,-0.9,-9.9,-6.3,-19.29
2026-07-15,NASDAQ,EchoStar  Corporation Common Stock,ECHO,27903.2,96.56999969482422,-4.86,-21.58,-14.71,196.32
2026-07-15,NYSE,FirstEnergy Corp. Common Stock,FE,27822.5,48.63999938964844,2.31,2.36,2.75,13.88
2026-07-15,NYSE,Sunbelt Rentals Holdings Inc. Common Stock,SUNB,28806.2,72.98999786376953,-2.43,-4.63,0.0,0.0
2026-07-15,NYSE,Otis Worldwide Corporation Common Stock,OTIS,27654.4,72.19999694824219,0.84,-7.29,-15.48,-15.74
2026-07-15,NYSE,Eversource Energy (D/B/A) Common Stock,ES,27754.7,73.79000091552734,2.1,4.37,6.74,11.63
2026-07-15,NASDAQ,Willis Towers Watson Public Limited Company Ordinary Shares,WTW,27633.6,285.1199951171875,9.09,11.29,-10.19,-9.72
2026-07-15,NYSE,Kinross Gold Corporation Common Stock,KGC,27535.9,23.65999984741211,0.17,-21.76,-25.03,47.87
2026-07-15,NYSE,Pembina Pipeline Corp. Ordinary Shares (Canada),PBA,28084.8,50.33000183105469,8.82,8.19,21.04,35.33
